{
  "config": {
    "output": {
      "basename": "Pedro_Lucas_Reis_Tech_Lead",
      "directory": "E:\\Hermes\\vault\\scripts\\gerador-curriculo\\output\\04_tech_lead",
      "generate_docx": true,
      "generate_pdf": true
    },
    "colors": {
      "primary": "#1F374D",
      "text": "#222222",
      "muted": "#5A5A5A",
      "divider": "#D9E0E6"
    },
    "tech_label": "Tecnologias",
    "section_names": {
      "summary": "Resumo Profissional",
      "skills": "Competências Técnicas",
      "soft_skills": "Competências Comportamentais",
      "experience": "Experiência Profissional",
      "education": "Formação Acadêmica",
      "languages": "Idiomas",
      "certifications": "Certificações"
    }
  },
  "person": {
    "name": "Pedro Lucas Reis",
    "location": "Volta Redonda, RJ - Brasil",
    "work_preference": "100% Remoto (Brasil e Internacional)",
    "phone": "+55 (24) 99326-4040",
    "email": "pedrosousa2160@gmail.com",
    "linkedin": "https://www.linkedin.com/in/pedro-lucas-reis-a93945171/",
    "portfolio": "https://pedroreoli.vercel.app",
    "github": "https://github.com/PedroReoli"
  },
  "headline": "Tech Lead / Especialista Frontend | React • Next.js • TypeScript • Design Systems • Mentoria",
  "summary": "Líder Técnico e Especialista em Engenharia de Software com foco em governança de arquitetura frontend, Design Systems e formação de times de alta performance. Arquiteto do Design System da Autocom3 com mais de 500 componentes (redução de 70% no lead time de desenvolvimento de telas) e do ecossistema Portal ERP com mais de 100 páginas em produção. Experiência comprovada em mentoria técnica (mais de 30 desenvolvedores e profissionais capacitados em parceria com UniFOA e SEBRAE).",
  "target_keywords": [
    "Tech Lead",
    "Liderança Técnica",
    "Design Systems",
    "Arquitetura Frontend",
    "Code Review",
    "Mentoria",
    "React",
    "Next.js",
    "TypeScript",
    "System Design"
  ],
  "skills": {
    "Liderança & Governança": [
      "Liderança Técnica de Squads",
      "Governança de Design Systems (500+ componentes)",
      "Code Review Rigoroso",
      "Definição de Padrões de Engenharia",
      "Mentoria Técnica"
    ],
    "Arquitetura Frontend": [
      "React (18/19)",
      "Next.js (App Router)",
      "TypeScript",
      "Microfrontends",
      "Core Web Vitals",
      "Design Tokens",
      "State Architecture"
    ],
    "Backend & Infraestrutura": [
      "Node.js",
      "NestJS",
      "C# / .NET",
      "APIs RESTful",
      "PostgreSQL",
      "SQL Server",
      "Docker",
      "AWS"
    ],
    "Engenharia & Qualidade": [
      "CI/CD Pipelines",
      "Clean Architecture",
      "Spec-Driven Development",
      "Workflows de IA com Governança"
    ]
  },
  "soft_skills": [
    "Comunicação Estratégica com Stakeholders",
    "Mentoria e Desenvolvimento de Pessoas",
    "Tomada de Decisão Arquitetural",
    "Resolução de Conflitos Técnicos",
    "Visão de Negócio"
  ],
  "experience": [
    {
      "company": "Autocom3",
      "role": "Tech Lead & Frontend Architect",
      "dates": "nov de 2024 – Presente",
      "location": "Volta Redonda, RJ",
      "work_mode": "Híbrido",
      "summary": "Liderança técnica de squad, governança arquitetural do Design System corporativo e direcionamento de engenharia para ecossistemas ERP de alta escala.",
      "bullets": [
        "Liderei a concepção, arquitetura e governança do Design System corporativo com mais de 500 componentes reutilizáveis, reduzindo em até 70% o ciclo de entrega de novas telas na squad.",
        "Arquitetei soluções corporativas e portais unificados com mais de 100 páginas em produção, atendendo com alta estabilidade a mais de 20 organizações clientes.",
        "Conduzi iniciativas de otimização de performance e Core Web Vitals que reduziram em até 40% o tempo de carregamento de aplicações ERP de missão crítica.",
        "Estabeleci padrões rigorosos de Code Review, tipagem estrita com TypeScript e boas práticas de engenharia em arquiteturas híbridas (.NET / Node.js / React).",
        "Atuei como referência técnica perante stakeholders de produto e desenvolvedores, definindo diretrizes de CI/CD, AWS e segurança."
      ],
      "technologies": [
        "Technical Leadership",
        "Software Architecture",
        "Design Systems (500+ comp)",
        "React",
        "Next.js",
        "TypeScript",
        "Code Review",
        "Node.js",
        "C#",
        "AWS",
        "CI/CD"
      ]
    },
    {
      "company": "Domus - Sua Solução Digital",
      "role": "Tech Lead / Software Engineer",
      "dates": "out de 2025 – Presente",
      "location": "Remoto",
      "work_mode": "Autônomo",
      "summary": "Direcionamento técnico e decisões arquiteturais no desenvolvimento de produtos digitais, aplicações SaaS e plataformas web corporativas.",
      "bullets": [
        "Defino a arquitetura técnica, escolha de stack e padrões de persistência para produtos SaaS escaláveis utilizando React, Next.js, Node.js e PostgreSQL.",
        "Implementei governança de desenvolvimento assistido por Inteligência Artificial na squad, acelerando a especificação e revisão de código em aproximadamente 35%.",
        "Asseguro altos padrões de engenharia com projetos alcançando métricas de ~100 no Google Lighthouse em Performance, Acessibilidade e SEO."
      ],
      "technologies": [
        "System Design",
        "React",
        "Next.js",
        "TypeScript",
        "Node.js",
        "PostgreSQL",
        "Supabase",
        "AI Engineering",
        "Mentoring"
      ]
    },
    {
      "company": "Centro Universitário de Volta Redonda (UniFOA) & SEBRAE",
      "role": "Líder Técnico & Mentor de Tecnologia",
      "dates": "jun de 2024 – dez de 2024",
      "location": "Volta Redonda, RJ",
      "work_mode": "Presencial / Temporário",
      "summary": "Liderança pedagógica e técnica no programa EvaTech voltado à formação de talentos em tecnologia e inteligência artificial.",
      "bullets": [
        "Liderei trilhas de formação prática capacitando mais de 30 alunos em desenvolvimento de software, pensamento algorítmico e IA generativa aplicada.",
        "Orientei squads no desenvolvimento de projetos práticos, promovendo boas práticas de engenharia, facilitação técnica e comunicação assertiva.",
        "Desenvolvi competências sólidas de mentoria, alinhamento interpessoal e liderança com empatia técnica."
      ],
      "technologies": [
        "Liderança Técnica",
        "Mentoria de Squads",
        "Inteligência Artificial",
        "Facilitação Ágil",
        "Comunicação"
      ]
    },
    {
      "company": "SIVIS Tecnologia",
      "role": "Full Stack Engineer | Lead de Integrações",
      "dates": "nov de 2025 – Presente",
      "location": "Remoto",
      "work_mode": "Freelance",
      "summary": "Direcionamento na modernização de interfaces corporativas e integração de serviços de missão crítica.",
      "bullets": [
        "Conduzi a refatoração arquitetural de interfaces legadas aplicando componentização consistente, reduzindo retrabalhos de frontend em cerca de 25%.",
        "Otimizei queries e rotinas de banco de dados em PostgreSQL e MySQL, proporcionando ganho de performance de aproximadamente 35% em relatórios operacionais."
      ],
      "technologies": [
        "Arquitetura de Software",
        "React",
        "Next.js",
        "TypeScript",
        "PostgreSQL",
        "MySQL",
        "Clean Architecture"
      ]
    },
    {
      "company": "SIVIS Tecnologia",
      "role": "Junior Full Stack Engineer",
      "dates": "ago de 2022 – jun de 2024",
      "location": "Volta Redonda, RJ",
      "work_mode": "Híbrido",
      "summary": "Desenvolvimento de dashboards e módulos ERP com forte foco em colaboração e qualidade de software.",
      "bullets": [
        "Participei ativamente de rituais ágeis (Scrum/Kanban), pair programming e code reviews, entregando mais de 30 interfaces corporativas ativas em produção."
      ],
      "technologies": [
        "React",
        "TypeScript",
        "Node.js",
        "C#",
        "PostgreSQL",
        "Scrum",
        "Git"
      ]
    }
  ],
  "education": [
    {
      "degree": "Bacharelado em Sistemas de Informação",
      "institution": "Centro Universitário de Volta Redonda (UniFOA)",
      "dates": "Concluído em 2025"
    }
  ],
  "languages": [
    {
      "language": "Português",
      "level": "Nativo"
    },
    {
      "language": "Inglês",
      "level": "B2 / Intermediário funcional"
    }
  ],
  "certifications": [
    {
      "name": "Formação Completa em Frontend & UI/UX Design",
      "issuer": "Origamid",
      "date": "mai de 2026"
    }
  ]
}
